5-892;Andere Inzision an Haut und Unterhaut;138322;1257;110,0414;0,404;0,5694;0,691;0,7842;0,8575
5-894;Lokale Exzision von erkranktem Gewebe an Haut und Unterhaut;109640;1214;90,313;0,4007;0,5682;0,6874;0,7814;0,8524
5-895;Radikale und ausgedehnte Exzision von erkranktem Gewebe an Haut und Unterhaut;145886;1167;125,0094;0,6623;0,7859;0,854;0,901;0,9361
5-896;Chirurgische Wundtoilette [Wunddebridement] mit Entfernung von erkranktem Gewebe an Haut und Unterhaut;230823;1250;184,6584;0,4036;0,5901;0,7144;0,8045;0,8733
5-897;Exzision und Rekonstruktion eines Sinus pilonidalis;26995;1040;25,9567;0,2743;0,4439;0,578;0,6878;0,7791
5-898;Operationen am Nagelorgan;12378;1035;11,9594;0,4748;0,6423;0,7479;0,8232;0,8795
5-899;Andere Exzision an Haut und Unterhaut;1368;513;2,6667;0,4218;0,5621;0,6594;0,7339;0,8099
5-900;Einfache Wiederherstellung der Oberflächenkontinuität an Haut und Unterhaut;158646;1256;126,3105;0,3672;0,5565;0,6889;0,7879;0,8644
5-901;Freie Hauttransplantation, Entnahmestelle;17993;953;18,8804;0,5389;0,7031;0,8019;0,8703;0,916
5-902;Freie Hauttransplantation, Empfängerstelle;50608;1099;46,0491;0,5486;0,7274;0,818;0,8791;0,9223
5-903;Lokale Lappenplastik an Haut und Unterhaut;91362;996;91,7289;0,749;0,8932;0,944;0,9676;0,9804
5-904;Lappenplastik an Haut und Unterhaut, Entnahmestelle;2155;300;7,1833;0,5304;0,7132;0,8139;0,8784;0,9169
5-905;Lappenplastik an Haut und Unterhaut, Empfängerstelle;5244;483;10,8571;0,5153;0,7155;0,8238;0,8888;0,93
5-906;Kombinierte plastische Eingriffe an Haut und Unterhaut;2976;421;7,0689;0,584;0,7436;0,8313;0,881;0,915
5-907;Revision einer Hautplastik;6326;595;10,6319;0,5466;0,7518;0,846;0,8987;0,9314
5-908;Plastische Operation an Lippe und Mundwinkel;5252;535;9,8168;0,5906;0,7917;0,8667;0,9067;0,936
5-909;Andere Wiederherstellung und Rekonstruktion von Haut und Unterhaut;3110;498;6,245;0,5521;0,7077;0,7977;0,8585;0,9013
5-910;Straffungsoperation am Gesicht;404;113;3,5752;0,4975;0,6386;0,7327;0,797;0,8564
5-911;Gewebereduktion an Haut und Unterhaut;14229;675;21,08;0,616;0,7992;0,8796;0,9253;0,9538
5-912;Haartransplantation und Haartransposition;11;10;1,10;0,1818;0,2727;0,3636;0,4545;0,5455
5-913;Entfernung oberflächlicher Hautschichten;23557;634;37,1562;0,8204;0,9216;0,9528;0,9695;0,9798
5-914;Chemochirurgie der Haut;1595;110;14,50;0,8784;0,9179;0,9417;0,9561;0,9655
5-915;Destruktion von erkranktem Gewebe an Haut und Unterhaut;11248;473;23,7801;0,7904;0,9113;0,9489;0,9647;0,9754
5-916;Temporäre Weichteildeckung;168041;1192;140,974;0,4344;0,6096;0,7279;0,8122;0,8752
5-917;Syndaktylie- und Polydaktyliekorrektur der Finger;791;167;4,7365;0,5853;0,7067;0,7826;0,8432;0,8862
5-918;Syndaktylie- und Polydaktyliekorrektur der Zehen;339;123;2,7561;0,4336;0,5752;0,6667;0,7375;0,8142
5-919;Operative Versorgung von Mehrfachtumoren an einer Lokalisation der Haut in einer Sitzung;3665;189;19,3915;0,5989;0,7896;0,8802;0,9304;0,958
5-91a;Andere Operationen an Haut und Unterhaut;643;336;1,9137;0,3499;0,4946;0,6003;0,6858;0,7387
5-920;Inzision an Haut und Unterhaut bei Verbrennungen und Verätzungen;458;70;6,5429;0,4847;0,7162;0,845;0,8886;0,9192
5-921;Chirurgische Wundtoilette [Wunddebridement] und Entfernung von erkranktem Gewebe an Haut und Unterhaut bei Verbrennungen und Verätzungen;23987;755;31,7709;0,8082;0,8923;0,9318;0,9551;0,9702
5-922;Wunddebridement an Muskel, Sehne und Faszie bei Verbrennungen und Verätzungen;515;213;2,4178;0,4058;0,5767;0,6738;0,7515;0,7942
5-923;Temporäre Weichteildeckung bei Verbrennungen und Verätzungen;8634;243;35,5309;0,7095;0,8677;0,9313;0,9631;0,9783
5-924;Freie Hauttransplantation und Lappenplastik an Haut und Unterhaut bei Verbrennungen und Verätzungen, Entnahmestelle;553;196;2,8214;0,4901;0,6239;0,7071;0,7758;0,8228
5-925;Freie Hauttransplantation und Lappenplastik an Haut und Unterhaut bei Verbrennungen und Verätzungen, Empfängerstelle;4846;390;12,4256;0,7889;0,8716;0,9109;0,9373;0,9548
5-926;Lokale Lappenplastik an Haut und Unterhaut bei Verbrennungen und Verätzungen;666;171;3,8947;0,5631;0,6877;0,7643;0,8198;0,8724
5-927;Kombinierte plastische Eingriffe an Haut und Unterhaut bei Verbrennungen und Verätzungen;57;42;1,3571;0,1579;0,2982;0,4737;0,5614;0,6316
5-928;Primärer Wundverschluss der Haut und Revision einer Hautplastik bei Verbrennungen und Verätzungen;616;200;3,08;0,5601;0,6656;0,7386;0,8036;0,8377
5-929;Andere Operationen bei Verbrennungen und Verätzungen;129;50;2,58;0,4806;0,6047;0,6822;0,7597;0,8062
5-930;Art des Transplantates;64900;688;94,3314;0,3947;0,6036;0,7477;0,8522;0,921
5-931;Verwendung von hypoallergenem Knochenersatz- und Osteosynthesematerial;35242;546;64,5458;0,6053;0,811;0,9172;0,9596;0,9793
5-932;Art des verwendeten Materials für Gewebeersatz und Gewebeverstärkung;211728;1071;197,6919;0,2813;0,4505;0,5843;0,695;0,7884
5-933;Verwendung einer Kunststoff- oder biologischen Membran zur Prophylaxe von Adhäsionen;4423;255;17,3451;0,7897;0,8809;0,9258;0,9498;0,9659
5-934;Verwendung von MRT-fähigem Material;11358;506;22,4466;0,5577;0,7399;0,8399;0,901;0,9397
5-935;Verwendung von beschichtetem Osteosynthesematerial;1118;139;8,0432;0,7191;0,8301;0,8792;0,9106;0,9356
5-936;Verwendung von Arzneimitteln für neuartige Therapien;109;20;5,45;0,5596;0,7523;0,844;0,8899;0,9083
5-937;Verwendung von thermomechanischem Osteosynthesematerial;205;34;6,0294;0,4683;0,7512;0,8341;0,8927;0,9171
5-981;Versorgung bei Mehrfachverletzung;1616;310;5,2129;0,487;0,6473;0,7556;0,8255;0,88
5-982;Versorgung bei Polytrauma;1527;255;5,9882;0,5599;0,7099;0,795;0,854;0,8946
5-983;Reoperation;167208;1140;146,6737;0,5804;0,7494;0,8462;0,9065;0,9447
5-984;Mikrochirurgische Technik;386967;959;403,5109;0,5539;0,7383;0,8465;0,9137;0,9539
5-985;Lasertechnik;44686;624;71,6122;0,5392;0,7305;0,8407;0,9126;0,9541
5-986;Minimalinvasive Technik;75671;868;87,1786;0,5905;0,7684;0,8663;0,9238;0,9598
5-987;Anwendung eines OP-Roboters;9851;94;104,7979;0,3516;0,5546;0,6997;0,8287;0,9164
5-988;Anwendung eines Navigationssystems;39810;497;80,1006;0,4526;0,6476;0,7707;0,854;0,9117
5-989;Fluoreszenzgestützte Therapieverfahren;8084;218;37,0826;0,5743;0,7522;0,8564;0,9177;0,9537
5-98a;Hybridtherapie;4156;208;19,9808;0,4949;0,6973;0,8104;0,8857;0,9324
5-98b;Anwendung eines flexiblen Ureterorenoskops;14515;265;54,7736;0,3453;0,5344;0,6799;0,7837;0,8681
5-98c;Anwendung eines Klammernahtgerätes;100711;829;121,4849;0,4137;0,6059;0,7332;0,8288;0,8972
5-98d;Verwendung von patientenindividuell hergestelltem Instrumentarium;1013;89;11,382;0,4235;0,619;0,7631;0,8569;0,9171
5-98e;Intraoperative Blutflussmessung in Gefäßen;9408;150;62,72;0,7231;0,8929;0,9523;0,9792;0,9887
5-995;Vorzeitiger Abbruch einer Operation (Eingriff nicht komplett durchgeführt);22483;1079;20,8369;0,5069;0,6914;0,8031;0,8732;0,9207
