drg;name;AnzahlHA;mwVwd;vwdStd;AnzKLHA;AntKLHA;AnzLLHA;AntLLHA
G72A;Andere leichte bis moderate Erkrankungen der Verdauungsorgane oder Abdominalschmerz oder mesenteriale Lymphadenitis, Alter < 3 Jahre;1224;1,6495;1,1462;705;0,576;28;0,0229
G72B;Andere leichte bis moderate Erkrankungen der Verdauungsorgane, Alter > 2 Jahre oder Abdominalschmerz oder mesenteriale Lymphadenitis, Alter > 2 Jahre und Alter < 56 Jahre oder ohne CC;136973;2,092;1,7298;67087;0,4898;6195;0,0452
G73Z;Gastrointestinale Blutung oder Ulkuserkrankung mit äußerst schweren CC, mehr als ein Belegungstag;21343;6,5337;4,1324;0;0,00;1265;0,0593
G74Z;Hämorrhoiden;9037;3,053;2,5497;2733;0,3024;442;0,0489
G77Z;Komplexbehandlung bei multiresistenten Erregern bei Krankheiten und Störungen der Verdauungsorgane;3280;14,8177;8,8321;0;0,00;318;0,097
H01A;Eingriffe an Pankreas und Leber und portosystemische Shuntoperationen mit großem Eingriff oder Strahlentherapie, mit komplexem Eingriff;2019;22,9619;12,3587;13;0,0064;286;0,1417
H01B;Eingriffe an Pankreas und Leber und portosystemische Shuntoperationen mit großem Eingriff oder Strahlentherapie, ohne komplexen Eingriff;7165;20,6124;11,3341;47;0,0066;898;0,1253
H02A;Komplexe Eingriffe an Gallenblase und Gallenwegen bei bösartiger Neubildung;883;21,3635;10,7654;10;0,0113;76;0,0861
H02B;Komplexe Eingriffe an Gallenblase und Gallenwegen außer bei bösartiger Neubildung;1446;18,9841;11,6185;59;0,0408;138;0,0954
H05Z;Laparotomie und mäßig komplexe Eingriffe an Gallenblase und Gallenwegen;4349;13,2854;9,0128;342;0,0786;360;0,0828
H06A;Andere OR-Prozeduren an hepatobiliärem System und Pankreas mit bestimmtem Eingriff und komplexer Diagnose, Dialyse, komplexer OR-Prozedur oder komplizierender Konstellation;1719;17,5119;14,7373;156;0,0908;232;0,135
H06B;Andere OR-Prozeduren an hepatobiliärem System und Pankreas, ohne bestimmten Eingriff und komplexe Diagnose, Dialyse, komplexe OR-Prozedur oder komplizierende Konstellation, mit selektiver Embolisation;2840;4,132;5,0854;615;0,2165;263;0,0926
H06C;Andere OR-Prozeduren an hepatobiliärem System und Pankreas, ohne bestimmten Eingriff und komplexe Diagnose, Dialyse, komplexe OR-Prozedur oder komplizierende Konstellation, ohne selektive Embolisation;6084;5,7753;7,4908;1165;0,1915;702;0,1154
H07A;Cholezystektomie mit sehr komplexer Diagnose oder komplizierender Konstellation;627;15,4928;9,6687;19;0,0303;72;0,1148
H07B;Cholezystektomie ohne sehr komplexe Diagnose, ohne komplizierende Konstellation;9417;10,6654;6,4781;102;0,0108;949;0,1008
H08A;Laparoskopische Cholezystektomie mit sehr komplexer oder komplizierender Diagnose;3293;10,9699;5,8347;127;0,0386;169;0,0513
H08B;Laparoskopische Cholezystektomie ohne sehr komplexe Diagnose, ohne komplizierende Diagnose;149829;4,8802;3,4218;891;0,0059;11149;0,0744
H09A;Eingriffe an Pankreas und Leber und portosystemische Shuntoperationen, ohne großen Eingriff, ohne Strahlentherapie, mit äußerst schweren CC;4083;22,3057;14,8604;217;0,0531;538;0,1318
H09B;Eingriffe an Pankreas und Leber und portosystemische Shuntoperationen, ohne großen Eingriff, ohne Strahlentherapie, bei bösartiger Neubildung oder mit bestimmtem Eingriff am Pankreas;3458;12,4118;6,6237;49;0,0142;284;0,0821
H09C;Eingriffe an Pankreas und Leber und portosystemische Shuntoperationen, ohne großen Eingriff, ohne Strahlentherapie, außer bei bösartiger Neubildung, ohne bestimmten Eingriff am Pankreas;1635;9,2318;6,3647;94;0,0575;113;0,0691
H12A;Verschiedene Eingriffe am hepatobiliären System mit äußerst schweren CC oder komplexem Eingriff;4683;22,8883;14,8368;309;0,066;614;0,1311
H12B;Verschiedene Eingriffe am hepatobiliären System ohne äußerst schwere CC, ohne komplexen Eingriff;5960;8,9169;7,7738;1301;0,2183;314;0,0527
H15Z;Strahlentherapie bei Krankheiten und Störungen an hepatobiliärem System und Pankreas, mehr als ein Belegungstag, mehr als 9 Bestrahlungen;351;23,4245;14,2361;19;0,0541;40;0,114
H16Z;Andere Strahlentherapie bei Krankheiten und Störungen an hepatobiliärem System und Pankreas, mehr als ein Belegungstag;3196;4,9847;5,133;0;0,00;329;0,1029
H33Z;Mehrzeitige komplexe OR-Prozeduren bei Krankheiten und Störungen an hepatobiliärem System und Pankreas;921;34,9805;22,221;54;0,0586;192;0,2085
H36Z;Intensivmedizinische Komplexbehandlung > 588 / 552 Aufwandspunkte bei Krankheiten und Störungen an hepatobiliärem System und Pankreas;2172;36,6607;24,1247;52;0,0239;502;0,2311
H37Z;Längerer stationärer Aufenthalt vor Transplantation bei hoher Dringlichkeitsstufe bei Krankheiten und Störungen an hepatobiliärem System und Pankreas;0;0,00;NULL;0;0,00;0;0,00
H38Z;Komplizierende Konstellation mit bestimmtem operativen Eingriff bei Krankheiten und Störungen an hepatobiliärem System und Pankreas;523;25,5946;21,6755;91;0,174;85;0,1625
H40Z;Endoskopische Eingriffe bei Ösophagusvarizenblutung;4105;9,3262;7,247;472;0,115;292;0,0711
H41A;Komplexe therapeutische ERCP mit äußerst schweren CC oder photodynamische Therapie oder ERCP mit perkutan-transluminalen Verfahren;7580;18,7792;11,7535;478;0,0631;715;0,0943
H41B;Komplexe therapeutische ERCP mit schweren CC, ohne photodynamische Therapie oder Alter < 16 Jahre oder komplexer Eingriff, ohne perkutan-transluminales Verfahren;17236;10,5003;7,1785;2603;0,151;1012;0,0587
H41C;Komplexe therapeutische ERCP ohne äußerst schwere oder schwere CC, ohne photodynamische Therapie, Alter > 15 Jahre, ohne komplexen Eingriff, oder andere ERCP;90939;5,2347;4,4475;17972;0,1976;5874;0,0646
H44Z;Geriatrische frührehabilitative Komplexbehandlung bei Krankheiten und Störungen an hepatobiliärem System und Pankreas;1987;23,0146;7,5298;0;0,00;142;0,0715
H60Z;Leberzirrhose und bestimmte nichtinfektiöse Hepatitiden mit äußerst schweren CC;9608;14,4306;10,0647;1242;0,1293;715;0,0744
H61A;Bösartige Neubildung an hepatobiliärem System und Pankreas, mehr als ein Belegungstag, mit komplexer Diagnose, mit äußerst schweren CC oder Pfortaderthrombose;8224;11,796;8,4619;1052;0,1279;720;0,0875
H61B;Bösartige Neubildung an hepatobiliärem System und Pankreas, ein Belegungstag oder ohne komplexe Diagnose oder ohne äußerst schwere CC, ohne Pfortaderthrombose;55245;4,5222;4,8448;17388;0,3147;3813;0,069
H62A;Erkrankungen des Pankreas außer bösartige Neubildung mit akuter Pankreatitis, Alter < 16 Jahre;406;5,3424;5,4045;39;0,0961;24;0,0591
H62B;Erkrankungen des Pankreas außer bösartige Neubildung mit akuter Pankreatitis, Alter > 15 Jahre oder Leberzirrhose und bestimmte nichtinfektiöse Hepatitiden ohne äußerst schwere CC;83765;7,3894;5,4531;14220;0,1698;4893;0,0584
H62C;Erkrankungen des Pankreas außer bösartige Neubildung ohne akute Pankreatitis;5995;5,3256;4,7873;1047;0,1746;281;0,0469
H63A;Erkrankungen der Leber außer bösartige Neubildung, Leberzirrhose und best. nichtinfekt. Hepatitiden, mehr als ein Belegungstag, mit komplexer Diagnose und äußerst schw. oder schw. CC oder mit kompl. Diagnose oder äußerst schw. oder schw. CC, Alter < 1 J.;4096;11,5269;8,8335;582;0,1421;293;0,0715
H63B;Erkrankungen der Leber außer bösartige Neubildung, Leberzirrhose und bestimmte nichtinfektiöse Hepatitiden, mehr als ein Belegungstag, mit komplexer Diagnose oder äußerst schweren oder schweren CC, Alter > 0 Jahre;5847;8,7051;6,4893;699;0,1195;395;0,0676
H63C;Erkrankungen der Leber außer bösartige Neubildung, Leberzirrhose und bestimmte nichtinfektiöse Hepatitiden, ein Belegungstag oder ohne komplexe Diagnose und ohne äußerst schwere oder schwere CC;16933;4,0521;3,8893;6149;0,3631;885;0,0523
H64Z;Erkrankungen von Gallenblase und Gallenwegen;37702;4,6082;3,996;9221;0,2446;2072;0,055
H78Z;Komplizierende Konstellation bei bestimmten Krankheiten und Störungen an hepatobiliärem System und Pankreas;1080;18,1639;18,9554;309;0,2861;144;0,1333
I01Z;Beidseitige Eingriffe oder mehrere große Eingriffe an Gelenken der unteren Extremität mit komplexer Diagnose;3085;39,6201;22,7678;19;0,0062;664;0,2152
I02A;Großfl. Gewebe- / Hauttransplantation, außer an der Hand, mit komplizierender Konstellation, Eingriff an mehreren Lokalisationen oder mit schwerem Weichteilschaden, mit äußerst schweren CC und komplexer OR-Prozedur;803;63,4981;37,5367;26;0,0324;335;0,4172
I02B;Großfl. Gewebe- / Hauttransplantation, auß. an d. Hand, m. kompliz. Konst., Eingr. an mehr. Lokal. od. schw. Weichteilschaden, m. äuß. schwer. CC od. kompl. OR-Proz. oder mit hochkompl. Gewebetransplantation oder bei bösart. Neub. und kompl. OR-Prozedur;2515;49,8231;29,956;82;0,0326;755;0,3002
I02C;Großfl. Gewebe- / Hauttransplantation, außer an der Hand, mit kompliz. Konst., Eingriff an mehreren Lokalisationen oder schw. Weichteilschaden, ohne äuß. schw. CC, ohne komplexe OR-Prozedur od. mit komplexer plast. Rekonstruktion od. kompl. OR-Prozedur;2069;36,8163;21,0246;79;0,0382;443;0,2141
I02D;Kleinflächige oder großflächige Gewebe- / Hauttransplantation, außer an der Hand, mit äußerst schweren CC;3986;30,4054;19,0385;225;0,0564;686;0,1721
I03A;Revision oder Ersatz des Hüftgelenkes mit kompl. Diagnose od. Arthrodese od. Alter < 16 Jahre od. beidseitige Eingriffe od. mehrere große Eingr. an Gelenken der unteren Extremität mit kompl. Eingr., mit äußerst schw. CC, od. Eingr. an mehreren Lok.;2279;32,0347;21,5053;64;0,0281;430;0,1887
I03B;Revision oder Ersatz des Hüftgelenkes mit kompl. Diagnose od. Arthrodese od. Alter < 16 Jahre od. beidseitige Eingriffe od. mehrere große Eingr. an Gelenken der unteren Extremität mit kompl. Eingr., oh. äußerst schw. CC, oh. Eingr. an mehreren Lok.;5481;21,3384;11,9579;23;0,0042;586;0,1069
I04Z;Implantation, Wechsel oder Entfernung einer Endoprothese am Kniegelenk mit komplizierender Diagnose oder Arthrodese;4907;20,3428;13,1336;22;0,0045;655;0,1335
I05A;Revision oder Ersatz des Hüftgelenkes ohne komplizierende Diagnose, ohne Arthrodese, ohne komplexen Eingriff, mit äußerst schweren CC;8773;16,4668;9,1857;576;0,0657;774;0,0882
I05B;Anderer großer Gelenkersatz;17761;11,1964;5,4682;130;0,0073;1181;0,0665
I06A;Komplexe Eingriffe an der Wirbelsäule mit Wirbelsäulenrelease oder mit bestimmtem mehrzeitigem Eingriff oder mit Eingriff an mehreren Lokalisationen oder mit komplizierender Konstellation, oder bei Para- / Tetrapl. mit äußerst schweren CC;1056;29,7623;22,1119;43;0,0407;207;0,196
I06B;Komplexe Eingriffe an Wirbelsäule, Kopf und Hals mit hochkomplexem Eingriff an der Wirbelsäule oder komplexem Eingriff an Kopf und Hals, Alter < 19 Jahre oder mit sehr komplexem Eingriff bei schwerer entzündlicher Erkrankung;748;17,0936;12,1313;5;0,0067;108;0,1444
I06C;Komplexe Eingriffe an der Wirbelsäule mit sehr komplexem Eingriff an Wirbelsäule ohne schwer entz. Erkr. oder mit Wirbelkörperersatz oder bei schwerer entzündlicher Erkrankung oder bösartiger Neubildung, mit äußerst schweren CC oder Halotraktion;2730;22,0172;14,9365;48;0,0176;369;0,1352
I06D;Komplexe Eingriffe an Wirbelsäule, Kopf und Hals ohne hochkomplexen oder sehr komplexen Eingriff, ohne Wirbelkörperersatz, ohne schwere entzündliche Erkrankung, ohne bösartige Neubildung, ohne äußerst schwere CC, ohne Halotraktion;80;7,00;5,8418;2;0,025;8;0,10
I07Z;Amputation bei Krankheiten und Störungen an Muskel-Skelett-System und Bindegewebe;1943;19,8441;13,2692;89;0,0458;206;0,106
I08A;And. mäßig kompl. Eingriffe an Hüftgelenk und Femur mit kompl. Mehrfacheingriff oder mit sehr kompl. Diagnosen, mit Osteotomie oder Muskel- / Gelenkplastik bei Zerebralparese oder Kontraktur oder mit best. Eingriff bei Beckenfraktur;801;21,0612;15,3485;52;0,0649;55;0,0687
I08B;And. mäßig kompl. Eingriffe an Hüftgelenk und Femur mit kompl. Mehrfacheingriff oder mit sehr kompl. Diagnosen, ohne Osteotomie oder Muskel- / Gelenkplastik bei Zerebralparese oder Kontraktur, ohne best. Eingriff bei Beckenfraktur, Alter< 16 Jahre;266;12,782;18,55;6;0,0226;35;0,1316
I08C;And. mäßig kompl. Eingriffe an Hüftgelenk und Femur mit kompl. Mehrfacheingr. od. sehr kompl. Diagn., Alter > 15 J. od. mit kompl. Eingr. od. äuß. schweren CC bei best. Beckenrepositionen;7978;22,6435;14,6991;304;0,0381;974;0,1221
I08D;And. mäßig kompl. Eingriffe an Hüftgelenk und Femur mit kompl. Eingriff od. äußerst schweren CC, oh. Osteotomie od. Muskel- / Gelenkplastik, od. oh. kompl. Eingr., oh. äuß. schw. CC, mit best. Beckenrep., oh. Osteotomie od. Muskel- / Gelenkplastik;28265;14,1165;8,1542;1167;0,0413;2115;0,0748
I08E;And. mäßig kompl. Eingr. an Hüftgel. und Femur m. kompl. Eingr. od. äuß. schw. CC ohne best. Beckenrep. mit Osteotomie od. Muskel- / Gelenkplastik od. ohne kompl. Eingr., ohne äuß. schw. CC, mit Osteot. od. Muskel- / Gelenkplastik, oh. best. Beckenrep.;769;7,2913;4,0499;7;0,0091;34;0,0442
I08F;And. Eingr. an Hüftgel. und Femur oh. kompl. Mehrfacheingr., oh. sehr kompl. Diagn., oh. kompl. Eingr., oh. äußerst schw. CC, oh. Osteot. od. Muskel- / Gelenkpl., oh. mäßig kompl. Eingr. und m. Knochentranspl. und -transp. am dist. Femur od. Revision;64857;10,8681;5,2936;4282;0,066;3268;0,0504
I08G;And. Eingr. Hüftgel. u. Femur od. Ers. Hüftgel. m. Eingr. an oberer Extremität od WS, oh. mäßig komplexer Eingriff, oh. Knochentransplantation und -transposition am distalen Femur oder Revision ohne Wechsel Endoprothetik Hüfte;5974;4,4555;3,7505;744;0,1245;376;0,0629
I09A;Bestimmte Eingriffe an der Wirbelsäule, mit sehr kompl. Osteosynthese und äuß. schw. CC od. mehrz. kompl. Eingr. od. kompl. Eingr. m. WK-Ersatz. od. versch. kompl. Eing. an mehreren Seg.;6054;23,6577;13,3629;108;0,0178;845;0,1396
I09B;Bestimmte Eingriffe an der Wirbelsäule, ohne sehr kompl. Osteosynth., ohne mehrz. kompl. Eingr., mit kompl. Osteosynth. und äußerst schw. CC;3018;24,4725;14,7907;94;0,0311;456;0,1511
I09C;Bestimmte Eingriffe an der Wirbelsäule, ohne kompl. Eingr., ohne WK-Ersatz, ohne versch. kompl. Eingr. an mehreren Seg., mit best. aufw. WS-Eingr., mit best. Kyphopl., m. best. Eingr. am Schädel, Gehirn, Rückenm. od. WS;12565;15,3245;8,4713;215;0,0171;1145;0,0911
I09D;Bestimmte Eingriffe an der Wirbelsäule, ohne kompl. Eingr., ohne WK-Ersatz, ohne versch. kompl. Eingr. an mehreren Seg., mit best. aufw. WS-Eingr., mit best. Kyphopl., ohne best. Eingr. an Schädel, Gehirn, Rückenm. od. WS;33489;11,4874;6,0209;395;0,0118;2555;0,0763
I09E;Bestimmte Eingriffe an der Wirbelsäule, ohne best. aufw. WS-Eingr., mit best. WS-Osteosynthesen, od. bei Para- / Tetraplegie od. bei HWS-Fraktur, od. m. intervertebrale Cages > 2 Seg.;12024;8,9039;5,5433;284;0,0236;847;0,0704
I09F;Bestimmte Eingriffe an der Wirbelsäule, ohne best. aufw. WS-Eingr., ohne best. WS-Osteosynthesen, ohne Para- / Tetraplegie ohne HWS-Fraktur, ohne intervertebrale Cages > 2 Seg.;23308;8,6679;5,5276;1064;0,0456;1882;0,0807
I10A;Andere Eingriffe an der Wirbelsäule mit bestimmtem Eingriff an Rückenmark, Spinalkanal, Wirbelsäule, Rumpf mit äußerst schwerem CC;3981;18,8754;13,1847;186;0,0467;499;0,1253
I10B;Andere Eingriffe an der Wirbelsäule mit best. kompl. Eingr. od. Halotraktion od. Para- / Tetraplegie, od. Wirbelfraktur mit bestimmten Eingriffen an Wirbelsäule, Spinalkanal und Bandscheibe ohne äußerst schw. CC;15017;9,364;6,2041;291;0,0194;1130;0,0752
I10C;Andere Eingriffe an der Wirbelsäule mit kompl. Eingriff an d. Wirbelsäule, mit intervertebralem Cage 1 Seg. od. bei best. Spinalkanalstenose od. best. Bandscheibenschäden;11229;5,989;3,3737;36;0,0032;673;0,0599
I10D;Andere Eingriffe an der Wirbelsäule mit kompl. Eingriff an d. Wirbelsäule, ohne intervertebralem Cage 1 Seg., ohne best. Spinalkanalstenose, ohne Bandscheibenschäden;30542;7,5445;4,6553;910;0,0298;2218;0,0726
I10E;Andere Eingriffe an der Wirbelsäule, ohne kompl. Eingr. an d. WS, ohne äuß. schw. CC, ohne Halotraktion, außer bei Para- / Tetraplegie, ohne Wirbelfraktur, mit mäßig kompl. Eingriff;78900;6,9607;4,3907;697;0,0088;6801;0,0862
I10F;Andere Eingriffe an der Wirbelsäule, ohne kompl. Eingriff, ohne äuß. schw. CC, ohne Halotraktion, auß. bei Para- / Tetraplegie, ohne Wirbelfraktur, ohne mäßig kompl. Eingriff, mit wenig kompl. Eingriff;5746;3,6377;3,8963;742;0,1291;301;0,0524
I10G;Andere Eingriffe an der Wirbelsäule, ohne kompl. Eingriff, ohne äuß. schw. CC, ohne Halotraktion, auß. bei Para- / Tetraplegie, ohne Wirbelfraktur, ohne mäßig kompl. Eingriff,ohne wenig kompl. Eingriff;3390;2,449;2,2544;1258;0,3711;153;0,0451
I11Z;Eingriffe zur Verlängerung einer Extremität;394;9,566;7,4333;52;0,132;16;0,0406
I12A;Knochen- und Gelenkinfektion / -entzündung mit verschiedenen Eingriffen am Muskel-Skelett-System und Bindegewebe mit äußerst schweren CC;3244;24,1754;15,8853;162;0,0499;457;0,1409
I12B;Knochen- und Gelenkinfektion / -entzündung mit verschiedenen Eingriffen am Muskel-Skelett-System und Bindegewebe mit schweren CC, mit Revision des Kniegelenkes oder Osteomyelitis, Alter < 16 Jahre;3090;15,2291;10,5591;277;0,0896;221;0,0715
I12C;Knochen- und Gelenkinfektion / -entzündung mit verschiedenen Eingriffen am Muskel-Skelett-System und Bindegewebe mit schweren CC, ohne Revision des Kniegelenkes, ohne Osteomyelitis, Alter > 15 Jahre;8165;9,0768;6,8149;1161;0,1422;588;0,072
I13A;Bestimmte Eingriffe an Humerus, Tibia, Fibula und Sprunggelenk mit komplexem Mehrfacheingriff oder aufwändiger Osteosynthese mit komplizierenden Eingriffen am Humerus;5110;17,5292;10,4248;289;0,0566;410;0,0802
I13B;Bestimmte Eingriffe an Humerus, Tibia, Fibula und Sprunggelenk mit komplexem Mehrfacheingriff oder aufwändiger Osteosynthese ohne komplizierenden Eingriffen am Humerus;5548;12,9047;6,9571;136;0,0245;353;0,0636
I13C;Bestimmte Eingriffe an Humerus, Tibia, Fibula und Sprunggelenk mit best. Mehrfacheingr. od. kompl. Diagn. od. best. kompl. Osteotomie bei kompl. Eingriff od. schw. Weichteilschaden, oder bestimmte Eingriffe bei Endoprothese der oberen Extremität;29853;10,3812;6,679;805;0,027;2083;0,0698
I13D;Bestimmte Eingriffe an Humerus, Tibia, Fibula und Sprunggelenk mit komplexem Eingriff oder schwerem Weichteilschaden oder komplexer Osteotomie bei mäßig komplexem Eingriff oder Pseudarthrose;27364;8,3971;4,7318;905;0,0331;1842;0,0673
I13E;Bestimmte Eingriffe an Humerus, Tibia, Fibula und Sprunggelenk mit mäßig komplexem Eingriff oder bei Pseudarthrose;35415;7,7275;4,7486;2250;0,0635;2008;0,0567
I13F;Bestimmte Eingriffe an Humerus, Tibia, Fibula und Sprunggelenk, ohne aufwändige Osteosynthese, ohne Mehrfacheingriff, ohne komplexe Diagnose, ohne komplexe Prozedur, ohne schweren Weichteilschaden, ohne mäßig komplexen Eingriff, ohne Pseudarthrose;48812;5,2452;4,0896;5040;0,1033;3542;0,0726
I14Z;Revision eines Amputationsstumpfes;846;11,7801;9,2474;127;0,1501;55;0,065
I15A;Operationen am Hirn- und Gesichtsschädel, mit bestimmtem intrakraniellen Eingriff oder außer Materialentfernung, Alter < 16 Jahre;890;9,2584;10,9812;25;0,0281;87;0,0978
I15B;Operationen am Hirn- und Gesichtsschädel, ohne bestimmten intrakraniellen Eingriff, Alter > 15 Jahre oder Materialentfernung;703;8,6444;8,5376;16;0,0228;61;0,0868
I16Z;Andere Eingriffe am Schultergelenk oder an der Klavikula, oder offene Repositionen bei einer Klavikulafraktur;63922;2,9409;2,0784;12790;0,2001;2507;0,0392
I17Z;Operationen am Gesichtsschädel;1633;6,7783;4,7333;88;0,0539;112;0,0686
I18A;Wenig komplexe Eingriffe an Kniegelenk, Ellenbogengelenk und Unterarm, Alter < 16 Jahre oder mit mäßig komplexem Eingriff oder mit beidseitigem Eingriff am Kniegelenk;17282;3,3864;3,3734;5238;0,3031;994;0,0575
I18B;Wenig komplexe Eingriffe an Kniegelenk, Ellenbogengelenk und Unterarm, Alter > 15 Jahre, ohne mäßig komplexen Eingriff, ohne beidseitigen Eingriff am Kniegelenk;67352;2,1943;2,1667;32201;0,4781;3240;0,0481
I20A;Eingriffe am Fuß, mit mehreren hochkomplexen Eingriffen, mit hochkomplexem Eingriff und komplexer Diagnose, mit Teilwechsel Endoprothese des unteren Sprunggelenks oder mit bestimmter Arthrodese;2633;12,7721;8,6545;281;0,1067;143;0,0543
I20B;Eingriffe am Fuß, mit mehreren komplexen Eingriffen, mit hochkomplexem Eingriff, bei Zerebralparese, mit Teilwechsel Endoprothese d. unteren Sprunggelenks, mit komplexem Eingriff bei komplexer Diagnose, mit Eingriff an Sehnen des Rückfußes;10102;9,0647;6,1867;1430;0,1416;509;0,0504
I20C;Eingr. am Fuß oh. mehr. kompl. Eingr., m. kompl. Eingr. od. schw. Weichteilsch. od. Osteomyelitis / Arthritis od. Eingr. Großz. m. kompl. Eingr. an mehr. Strah., m. Knochentx, m. Impl. Zehengel. od. bei Kalka., od. Einz. Mehrf. > 3 Mittelf.- / Zehenstr.;23512;5,2959;4,5417;1481;0,063;1196;0,0509
I20D;Eingriffe am Fuß ohne komplexe Eingriffe, mit Eingriff an mehr als einem Strahl oder chronischer Polyarthritis;12830;3,6822;2,535;1381;0,1076;331;0,0258
I20E;Eingriffe am Fuß ohne komplexen Eingriff, Alter < 16 Jahre;2585;2,8271;1,968;749;0,2897;116;0,0449
I20F;Eingriffe am Fuß ohne komplexen Eingriff, Alter > 15 Jahre;43901;3,1198;2,7765;11314;0,2577;1922;0,0438
I21Z;Lokale Exzision und Entfernung von Osteosynthesematerial an Hüftgelenk, Femur und Wirbelsäule oder komplexe Eingriffe an Ellenbogengelenk und Unterarm oder bestimmte Eingriffe an der Klavikula;94154;3,8174;2,9865;12847;0,1364;5294;0,0562
I22A;Gewebe- / Hauttransplantation, außer an der Hand, mit großfläch. Gewebetransplantation, mit komplizierender Konstellation, Eingriff an mehreren Lokalisationen, schwerem Weichteilschaden oder komplexer Gewebetransplantation mit schweren CC;1714;23,4895;14,2726;109;0,0636;239;0,1394
I22B;Gewebe- / Hauttransplantation, außer an der Hand, mit kleinflächiger Gewebetransplantation od. mit großflächiger Gewebetransplantation ohne kompliz. Konst., oh. Eingr. an mehreren Lokal., oh. schw. Weichteilschaden, oh. kompl. Gewebetranspl. m. schw. CC;2683;21,7078;13,5285;174;0,0649;248;0,0924
I23A;Lokale Exzision und Entfernung von Osteosynthesematerial außer an Hüftgelenk, Femur und Wirbelsäule mit komplizierendem Eingriff am Knochen;8104;2,5112;2,5511;3129;0,3861;341;0,0421
I23B;Lokale Exzision und Entfernung von Osteosynthesematerial außer an Hüftgelenk, Femur und Wirbelsäule ohne komplizierenden Eingriff am Knochen;43951;2,1417;2,7014;24169;0,5499;2185;0,0497
I24Z;Arthroskopie einschließlich Biopsie oder andere Eingriffe an Kniegelenk, Ellenbogengelenk und Unterarm;58117;1,8823;1,9556;34922;0,6009;1984;0,0341
I26Z;Intensivmedizinische Komplexbehandlung > 588 / 552 Aufwandspunkte oder hochaufwändiges Implantat bei hochkomplexer Gewebe- / Hauttransplantation;2026;37,1925;23,2001;19;0,0094;451;0,2226
I27A;Eingriffe am Weichteilgewebe oder kleinflächige Gewebetransplantationen mit bestimmter Diagnose und bestimmtem Eingriff, oder mit äußerst schweren CC oder bösartiger Neubildung und schweren CC und bestimmter Diagnose und komplexe Eingr.;544;15,671;9,8967;18;0,0331;41;0,0754
I27B;Eingr. am Weichteilg. oder kleinfl. Gewebetransplant., ohne best. Diagn. und best. Eingriff, ohne äuß. schw. CC oder bösartige Neub. und schw. CC, ohne schw. CC und mit bösartiger Neub. bei best. Eingr. am Weichteilgew. od. kleinfl. Gewebetransplant.;3695;17,4081;12,4086;378;0,1023;350;0,0947
I27C;Eingr. am Weichteilg. oder kleinfl. Gewebetransplant., oh. best. Diagnose und best. Eingriff, oh. Äußerst schw. CC oder bösartige Neub. und schw. CC, mit schw. CC u. mit bösartige Neub. bei best. Eingr. am Weichteilgew. od. kleinfl. Gewebetransplant.;5559;8,4044;7,0785;747;0,1344;396;0,0712
I27D;Eingr. am Weichteilg. oder kleinfl. Gewebetransplant., oh. best. Diagnose und best. Eingriff, oh. Äußerst schw. CC oder bösartige Neub. und schw. CC, oh. schw. CC und oh. bösartige Neub. bei best. Eingr. am Weichteilgew. od. kleinfl. Gewebetransplant.;51404;4,0537;3,2202;7892;0,1535;2739;0,0533
I28A;Komplexe Eingriffe am Bindegewebe;1454;6,8542;7,4838;241;0,1657;57;0,0392
I28B;Mäßig komplexe Eingriffe am Bindegewebe;7834;7,9081;7,821;1689;0,2156;502;0,0641
I28C;Andere Eingriffe am Bindegewebe;4182;4,2774;5,6199;1086;0,2597;392;0,0937
I29A;Komplexe Eingriffe am Schultergelenk oder bestimmte Osteosynthesen an der Klavikula, bei komplizierender Diagnose oder Eingriff an mehreren Lokalisationen;4926;5,4943;3,9056;168;0,0341;353;0,0717
I29B;Komplexe Eingriffe am Schultergelenk oder bestimmte Osteosynthesen an der Klavikula, ohne komplizierende Diagnose oder ohne Eingriff an mehreren Lokalisationen;67496;3,5187;2,0392;5083;0,0753;2369;0,0351
I30Z;Komplexe Eingriffe am Kniegelenk oder arthroskopische Eingriffe am Hüftgelenk;56758;4,1651;3,0716;3133;0,0552;3458;0,0609
I31A;Mehrere komplexe Eingriffe an Ellenbogengelenk und Unterarm oder gelenkübergreifende Weichteildistraktion bei angeborenen Anomalien der Hand, mit aufwändigen Eingriffen am Unterarm;3187;9,5353;5,8501;177;0,0555;197;0,0618
I31B;Mehrere komplexe Eingriffe an Ellenbogengelenk und Unterarm oder gelenkübergreifende Weichteildistraktion bei angeborenen Anomalien der Hand;13776;5,9559;4,4781;667;0,0484;1010;0,0733
I32A;Eingr. an Handgelenk u. Hand mit mehrzeitigem kompl. od. mäßig kompl. Eingr. od. mit Komplexbehandl. Hand od. mit aufwändigem rekonstruktiven Eingr. bei angeborener Fehlbildung der Hand oder mit best. gefäßgestielten Knochentx. bei Pseudarthrose der Hand;2146;12,4599;9,0302;162;0,0755;178;0,0829
I32B;Eingr. an Handgel. und Hand ohne mehrz. Eingr., oh. Komplexb. Hand, ohne aufw. rekonstr. Eingr., mit kompl. Eingr. od. b. angeb. Anomalie d. Hand od. Pseudarthr., Alter < 6 J. od. kompl. Eingr. b. angeb. Fehlb. d. Hand u. Alter < 16 J.;639;4,0798;2,7761;131;0,205;10;0,0156
I32C;Eingr. an Handg. und Hand oh. mehrz. Eingr., oh. Komplexb. Hand, mit kompl. Eingr. od. bei angeb. Anomalie d. Hand od. Pseudarthr., Alter > 5 J. od. oh. kompl. Eingr. b. angeb. Fehlb. d. Hand und Alter < 16 J., mit best. Eingr. od. kompl. Diag.;1897;6,1829;3,9205;269;0,1418;17;0,009
